"レコード番号","更新者","作成者","更新日時","作成日時","コース名","必修・選択","単位数","学期","科目群","科目名","（英文表記）","教員名","概要","目的・狙い","履修条件 （履修者数の上限、 要求する前提知識 等）","上位到達目標","下位到達目標","授業外の学習","授業の内容","科目ID","成績評価","教科書・教材","参考図書","内容①","授業実施形態①","内容➂","授業実施形態➂","内容④","授業実施形態④","内容⑤","授業実施形態⑤","内容⑥","授業実施形態⑥","内容⑦","授業実施形態⑦","内容⑧","授業実施形態⑧","内容⑨","授業実施形態⑨","内容⑩","授業実施形態⑩","内容⑪","授業実施形態⑪","内容⑫","授業実施形態⑫","内容⑬","授業実施形態⑬","内容⑭","授業実施形態⑭","内容⑮","授業実施形態⑮","内容（試験）","授業実施形態（試験）","程度（対面）","特徴・留意点（対面）","程度（ハイフレックス）","特徴・留意点（ハイフレックス）","程度（オンデマンド）","特徴・留意点（オンデマンド）","程度（その他）","特徴・留意点（その他）","内容②","授業実施形態②"
"51","yuta.hirose","takahashi-h","2022/01/04 23:49","2020/06/09 15:13","事業設計工学コース","選択","2","3Q","事業設計イノベーション","事業方向性設計演習","Roadmapping Workshop Design","廣瀬 雄大","本講義では、ロードマッピング思考を使った戦略の見える化を実施するために必要となる設計方法について理解を深めていく。このことによって、実際の社会活動の様々な場面で、ロードマッピング思考の実践的な理論の活用が実現できるものとなる。","本講義の目的は、ロードマッピングの実施に向けた設計について、グループ演習を通して体得することである。具体的には、実際に世の中で行われているロードマッピングを理解して役割と位置付けを学ぶこと、ロードマッピングの実施に向けた設計方法を学び、演習を通して体得すること、である。グループ演習を通して、組織内外のコミュニケーションを促進することの大切さや、組織体制づくりの支援をすること、そのアウトプットを組織内外に示すことについて、ロードマッピングにおける総合的な知見を身につけていく。

1-2-4 社会、市場、事業、技術、経営資源といった多方面の環境からの視点が獲得できる。（レベル4：単独で行うことができる）
2-1-4 社会、市場、事業、技術、経営資源といった多方面の調査を通して、情報収集力を獲得できる。（レベル4：単独で行うことができる）
2-3-4 戦略の見える化を学修し、それを実践で活用することができる。（レベル4：単独で行うことができる）
3-1-3 戦略の見える化を学修し、必要となる経営資源を理解することができ、それを開発できる。（レベル3：自分の専門領域を中心に単独で行うことができる）
4-3-4 演習を通して学生同士におけるネットワーク構築力を獲得できる。（レベル4：単独で行うことができる）","事業方向性設計特論またはエマージング・テクノロジー特論の履修を終えていることが望ましいが、必須ではない。
Microsoftのワード、エクセル、パワーポイントの基本を扱えることが望ましい。","・ロードマッピングの実施に向けた設計方法を理解して、他者へ説明できるレベル。
・起業または企業内新事業において、目的に合わせたロードマッピングの実施に向けた設計ができ、実践的にアウトプットできるレベル。","・ロードマッピングの役割や位置付けを理解できるレベル。
・ロードマッピングの実施に向けた設計方法を正確に理解し、活用方法や活用場面を理解しているレベル。","サーバーにアップロードされた講義資料をダウンロードして予習・復習すること。
課題が出ている場合には、事前に課題をこなしてくること。","講義はPPTの資料に基づいて行い、必要に応じて資料を配布する。","","以下の項目で評価を行う（合計100点）
・講義への参画度　 50点：講義内演習、プレゼンテーションを評価
・レポート課題　    30点：数回のレポート内容を評価
・最終試験             20点：講義終了後に、これまで獲得した知識・スキルを総合的に評価","教科書・教材は、サーバー上にアップロードした講義資料を提供する。","吉田敏、武市祥司、富田純一、ロバート・ファール、森下有、鎗目雅著、『技術経営―MOTの体系と実践』（理工図書社、2012年）
ロバート・ファール、クレア・ファルク、デービッド・プロバート著、『Roadmapping for Strategy and Innovation―Aligning Technology and Markets in a Dynamic World』（英国ケンブリッジ大学Institute for Manufacturing (IfM)、2010年）
トゥグリル・ダイム、テリー・オリバー、ロバート・ファール著、『Technology Roadmapping』（World Scientific Publishing、2018年）","本講義のガイダンス
本講義の目的と狙い、学修内容、課題、評価方法について解説し、学生が講義選択の判断ができるようにする。","その他","世の中で行われているロードマッピングの調査（1）
グループに分かれて、ロードマッピングの役割や位置付けについて理解を深めるために、世の中で実際に行われているロードマッピングについて背景、経緯、目的、実施内容、成果について調査を行う。","[ハ]","世の中で行われているロードマッピングの調査（2）
第 3 回の続きとして、グループに分かれて、ロードマッピングの役割や位置付けについて理解を深めるために、世の中で実際に行われているロードマッピングについて背景、経緯、目的、実施内容、成果について調査を行う。","[ハ]","世の中で行われているロードマッピングの調査（3）
第 4 回の続きとして、グループに分かれて、ロードマッピングの役割や位置付けについて理解を深めるために、世の中で実際に行われているロードマッピングについて背景、経緯、目的、実施内容、成果について調査を行う。","[ハ]","まとめと考察（前半）
これまで進めてきたロードマッピングの調査について、まとめと考察を行い、中間プレゼンテーションの準備を行う。","[ハ]","＜中間プレゼンテーション＞
各グループで進めてきた調査について全体で発表し、ロードマッピングの役割と位置付けの総論を行う。","[ハ]","ロードマッピングの実施に向けた設計方法の考え方
ロードマッピングを実施する際に必要となる設計方法の考え方について解説する。","[ハ]","ロードマッピングの実施に向けた設計演習（1）
演習テーマに沿って、グループに分かれてロードマッピングの実施に向けた設計を行う。","[ハ]","ロードマッピングの実施に向けた設計演習（2）
第 9 回の続きを行い、演習テーマに沿って、グループに分かれてロードマッピングの実施に向けた設計を行う。","[ハ]","ロードマッピング実施に向けた設計演習（3）
第 10 回の続きを行い、演習テーマに沿って、グループに分かれてロードマッピングの実施に向けた設計を行う。","[ハ]","＜グループ間意見交換＞
各グループがこれまで進めてきた設計の成果を、他のグループと共有し合い、今後のブラッシュアップに向けてグループ間で意見交換を行う。","[ハ]","設計内容のブラッシュアップ
第 12 回で行ったグループ間での意見交換に基づいて、各グループは設計内容のブラッシュアップを行う。","[ハ]","まとめと考察（後半）
これまで進めてきたロードマッピングの実施に向けた設計について、まとめと考察を行い、最終プレゼンテーションの準備を行う。","[ハ]","＜最終プレゼンテーション＞
これまで各グループで進めてきた演習内容の結果について、最終プレゼンテーションとして全体で発表し、ロードマッピングの実施に向けた設計方法について総論を行う。","[ハ]","本講義で紹介してきたロードマッピングを実施するための設計方法における知識・スキルに関する内容の試験を実施する。","その他","―","","○","教室または遠隔での出席を求め、双方向で多方面に行われる議論や討論、質疑応答を通した学修（これには学修内容を深めるための個人ワーク及びグループワークが含まれる）","―","","○","第1回はビデオ視聴のみで受講、試験はmanaba上でのオンライン実施とする","ロードマッピングの基礎と応用
本学のロードマッピング関連科目で紹介してきた学修内容の振り返りも含めて、基礎と応用、実践的な活用場面や方法について解説し、第 15 回まで取り組むグループを決める。","[ハ]"
"50","yuta.hirose","takahashi-h","2022/01/05 00:28","2020/06/09 15:13","事業設計工学コース","選択","2","1Q","事業設計イノベーション","事業方向性設計特論","Roadmapping for Technology Ventures","廣瀬 雄大","本講義では、起業または企業内新事業の立ち上げに向けた事業戦略立案支援の方法論について、必要となる分析と議論のプロセスについて理解を深め、実践で必要な知見を、演習を中心に身につけていく。","本講義の目的は、社会や市場、技術や経営資源などの変化の相互関係が、これから創り出される製品やサービスやシステムに大きな影響を及ぼす可能性があることを理解したうえで、起業・創業または企業内新事業の立ち上げに向けた戦略立案支援の方法論を学修することである。具体的には、ロードマッピング思考の理解を深めること、その方法論について演習を通して体得すること、である。

1-1-3 戦略の見える化に関するグループ演習を通して新結合力が獲得できる。（レベル3：自分の専門領域を中心に単独で行うことができる）
1-2-4 社会、市場、事業、技術、経営資源といった多方面の環境からの視点が獲得できる。（レベル4：単独で行うことができる）
1-3-3 戦略の見える化に関するグループ演習を通して事業構築力が獲得できる。（レベル3：自分の専門領域を中心に単独で行うことができる）
2-3-4 戦略の見える化に関する方法を学修し、それを実践で活用することができる。（レベル4：単独で行うことができる）
4-1-3 戦略立案支援の中で取り扱うビジネスモデル分析を通して将来像構築力を獲得できる。（レベル3：自分の門領域を中心に単独で行うことができる）","前提知識は特に必要なし。
Microsoftのワード、エクセル、パワーポイントの基本を扱えることが望ましい。","・ロードマッピング思考を使った事業戦略立案支援の方法論における基本的な考え方を理解して他者へ説明ができるレベル。
・本講義で学修するアプローチを実施することができ、事業戦略立案へ直接活かすことができるレベル。","・ロードマッピング思考を使った事業戦略立案支援の方法論における基本的な考え方を理解できるレベル。
・本講義で紹介するアプローチを正確に理解し、活用方法や活用場面を理解しているレベル。","サーバーにアップロードされた講義資料をダウンロードして予習・復習すること。
課題が出ている場合には、期限までに課題を提出すること。","講義はPPTの資料に基づいて行い、必要に応じて資料を配布する。","","以下の項目で評価を行う（合計100点）
・講義への参画度　50点：講義内演習、プレゼンテーションを評価
・レポート課題　   30点：数回のレポート内容を評価
・最終試験            20点：講義終了後に、これまで獲得した知識・スキルを総合的に評価","教科書・教材は、サーバー上にアップロードした講義資料を提供する。","吉田敏、武市祥司、富田純一、ロバート・ファール、森下有、鎗目雅著、『技術経営―MOTの体系と実践』（理工図書社、2012年）
ロバート・ファール、クレア・ファルク、デービッド・プロバート著、『Roadmapping for Strategy and Innovation―Aligning Technology and Markets in a Dynamic World』（英国ケンブリッジ大学Institute for Manufacturing (IfM)、2010年）
トゥグリル・ダイム、テリー・オリバー、ロバート・ファール著、『Technology Roadmapping』（World Scientific Publishing、2018年）","本講義のガイダンス
本講義の目的と狙い、学修内容、課題、最終試験、評価方法について解説し、学生が講義選択の判断ができるようにする。","その他","ロードマッピングの応用
ロードマップ策定・活用における応用について学術面及び実践面の内容も含めて解説する。","[ハ]","ロードマッピング思考を使った事業戦略立案プロセス
ロードマッピングの基礎と応用をふまえたうえで、ロードマッピング思考を使った事業戦略立案プロセスの全体と本科目で演習対象とする範囲を解説し、第15回まで進めていく演習のグループ決めをする。","[ハ]","戦略的テーマと方向性（１）
前提を設定したうえで戦略的テーマと方向性決めに向けてグループ演習をする。","[ハ]","戦略的テーマと方向性（２）
第5回の続きとして、前提を設定したうえで戦略的テーマと方向性決めに向けてグループ演習をする。","[ハ]","まとめと考察（前半）
各グループで進めてきた戦略的テーマと方向性決めについてまとめと考察を行い、中間プレゼンテーションに向けた準備を行う。","[ハ]","＜中間プレゼンテーション＞
各グループが決めた戦略的テーマと方向性について発表し、全体での意見交換を通して後半に向けたブラッシュアップを行う。","[ハ]","ビジョン構築（１）
第8回までの成果に基づいてビジョン構築を行うグループ演習をする。","[ハ]","ビジョン構築（２）
第9回の続きとして、第8回までの成果に基づいてビジョン構築を行うグループ演習をする。
","[ハ]","3ステップの道筋（１）
第9回と第10回で構築したビジョンの実現に向けた道筋を3ステップで策定するグループ演習をする。","[ハ]","3ステップの道筋（２）
第11回の続きとして、第9回と第10回で構築したビジョンの実現に向けた道筋を3ステップで策定するグループ演習をする。","[ハ]","＜グループ間意見交換＞
これまでに進めてきた演習の成果について、全体発表とグループ間意見交換を行い、ブラッシュアップを行う。","[ハ]","まとめと考察（後半）
これまで各グループで進めてきた演習内容について、総合的なまとめと考察を行い、最終プレゼンテーションに向けた準備を行う。","[ハ]","＜最終プレゼンテーション＞
各グループでまとめた演習成果を全体で発表し、ロードマッピング思考を使った事業戦略立案プロセスについて総論を行う。","[ハ]","本講義で紹介してきたロードマッピング思考を使った事業戦略立案支援の方法論における知識・スキルに関する内容の試験を実施する。","その他","―","","○","教室または遠隔での出席を求め、双方向で多方面に行われる議論や討論、質疑応答を通した学修（これには学修内容を深めるための個人ワーク及びグループワークが含まれる）","―","","○","第1回はビデオ視聴のみで受講、試験はmanaba上でのオンライン実施とする","ロードマッピングの基礎
ロードマップ策定・活用における基礎について学術面及び実践面の内容も含めて解説する。","[ハ]"
"49","yuta.hirose","takahashi-h","2022/01/04 23:50","2020/06/09 15:13","事業設計工学コース","選択","2","2Q","事業設計イノベーション","エマージング・テクノロジー特論","Emerging Technology Studies","廣瀬 雄大","本講義では、これまでの基盤的技術や応用技術の変化について俯瞰的に情報整理を行い、企業の戦略について俯瞰的分析を行う。社会レベルで大きな影響を与える可能性のある技術的変化の捉え方について、演習を中心に知見を身につけていく。","本講義の目的は、社会レベルで大きな影響を与える可能性がある技術的変化について、俯瞰的に理解をしていくために必要となる考え方や、認知手法の活用場面や活用方法を学ぶことである。具体的には、技術的変化の捉え方の理解を深めること、技術的変化の俯瞰的認知と分析における方法論を体得すること、である。

1-2-4 社会、市場、事業、技術、経営資源といった多方面の環境からの視点が獲得できる。（レベル4：単独で行うことができる）
2-1-3 俯瞰的に情報整理を行う手法を獲得し、それを情報収集の際に使用することができる。（レベル3：自分の専門領域を中心に単独で行うことができる）
2-3-3 俯瞰的認知手法を学修し、それを実践で活用することができる。（レベル3：自分の専門領域を中心に単独で行うことができる）
3-1-3 講義と演習を通して学修することによって、必要となる経営資源を理解することができ、それを開発できる。（レベル3：自分の専門領域を中心に単独で行うことができる）
","前提知識は特に必要ない。
Microsoftのワード、エクセル、パワーポイントの基本を扱えることが望ましい。
","・技術的変化における基本的な考え方を理解して他者へ説明ができるレベル。
・起業または企業内新事業において、技術的変化の俯瞰的な認知や分析を行うことができ、実践的なアウトプットができるレベル。","・技術的変化における基本的な考え方を理解できるレベル。
・技術的変化の俯瞰的な認知や分析における方法論を正確に理解し、実践的な活用場面や方法について理解できるレベル。","サーバーにアップロードされた講義資料をダウンロードして予習・復習をすること。
課題が出ている場合には、期限までに課題を提出すること。
","講義はPPTの資料に基づいて行い、必要に応じて資料を配布する。","","以下の項目で評価を行う（合計100点）
・講義への参画度　50点：講義内演習、プレゼンテーションを評価
・レポート課題　   30点：数回のレポート内容を評価
・最終試験　         20点：講義終了後に、これまで獲得した知識・スキルを総合的に評価","教科書・教材は、サーバー上にアップロードした講義資料を提供する。","吉田敏、武市祥司、富田純一、ロバート・ファール、森下有、鎗目雅著、『技術経営―MOTの体系と実践』（理工図書社、2012年）
ロバート・ファール、クレア・ファルク、デービッド・プロバート著、『Roadmapping for Strategy and Innovation―Aligning Technology and Markets in a Dynamic World』（英国ケンブリッジ大学Institute for Manufacturing (IfM)、2010年）
トゥグリル・ダイム、テリー・オリバー、ロバート・ファール著、『Technology Roadmapping』（World Scientific Publishing、2018年）
","本講義のガイダンス
本講義の目的と狙い、学修内容、課題、最終試験、評価方法について解説し、学生が講義選択の判断ができるようにする。","その他","技術的変化の過去分析マップ作成に向けた計画
各グループでテーマの設定をしたうえで、産業レベルの技術的変化における過去分析マップ作成に向けた計画を各グループで立てる。","[ハ]","技術的変化の過去分析マッピング（1）
産業レベルの技術的変化について、社会、市場、事業、技術、経営資源といった多方面の環境からの視点で過去分析マッピングを行う。","[ハ]","技術的変化の過去分析マッピング（2）
第 4 回の続きを行い、産業レベルの技術的変化について、社会、市場、事業、技術、経営資源といった多方面の環境からの視点で過去分析マッピングを行う。","[ハ]","要点整理マッピング
過去分析マッピングの結果に基づいて、産業レベルの技術的変化について、要点を整理するマッピングを行う。","[ハ]","知識ギャップの抽出
これまでに進めてきた過去分析マッピングと要点整理マッピングの結果に基づいて、更なる理解と分析が必要と考えられる点について知識ギャップを抽出する。","[ハ]","＜中間プレゼンテーション＞
各グループが進めてきた過去分析マッピングと要点整理マッピングについて、中間プレゼンテーションとして発表する。産業レベルの技術的変化と俯瞰的認知手法における役割と位置付けの理解を深めていく。","[ハ]","戦略の俯瞰的分析の考え方
産業レベルの技術的変化における企業の戦略分析の考え方について解説する。","[ハ]","戦略の俯瞰的分析（1）
各グループで検討してきた技術的変化の過去分析マッピングと要点整理マッピングに基づいて、企業の戦略について俯瞰的分析と議論を行う。","[ハ]","戦略の俯瞰的分析（2）
第 10 回の続きを行い、各グループで検討してきた技術的変化の過去分析マッピングと要点整理マッピングに基づいて、企業の戦略について俯瞰的分析と議論を行う。","[ハ]","戦略の俯瞰的分析（3）
第 11 回の続きを行い、各グループで検討してきた技術的変化の過去分析マッピングと要点整理マッピングに基づいて、企業の戦略について俯瞰的分析と議論を行う。","[ハ]","過去分析マップの総合的な考察のまとめ
各チームで検討してきた技術的変化の過去分析マッピング、要点整理マッピング、戦略の俯瞰的分析に基づいて、総合的な考察のまとめを各グループで行う。","[ハ]","最終プレゼンテーションに向けた準備
中間プレゼンテーションで発表した内容と後半で行った戦略の俯瞰的分析結果について総合的に発表するために、最終プレゼンテーションに向けて準備を行う。","[ハ]","＜最終プレゼンテーション＞
各チームで検討してきた技術的変化の過去分析結果と企業における戦略の俯瞰的分析を全体で発表し、産業レベルの技術的変化とロードマッピング思考を使った過去分析について総論を行う。","[ハ]","産業レベルの技術的変化と本講義で学修した過去分析マッピング等について、関連 知識・スキルに関する内容の試験を実施する。","その他","―","","○","教室または遠隔での出席を求め、双方向で多方面に行われる議論や討論、質疑応答を通した学修（これには学修内容を深めるための個人ワーク及びグループワークが含まれる）","―","","○","第1回はビデオ視聴のみで受講、試験はmanaba上でのオンライン実施とする","技術的変化の考え方と認知手法
産業レベルの技術的変化の基本的な考え方と、ロードマッピング思考を使った認知手法について解説し、第 15 回まで取り組むグループ決めをする。","[ハ]"
