"レコード番号","更新者","作成者","更新日時","作成日時","コース名","必修・選択","単位数","学期","科目群","科目名","（英文表記）","教員名","概要","目的・狙い","履修条件 （履修者数の上限、 要求する前提知識 等）","上位到達目標","下位到達目標","授業外の学習","授業の内容","科目ID","成績評価","教科書・教材","参考図書","内容①","授業実施形態①","内容➂","授業実施形態➂","内容④","授業実施形態④","内容⑤","授業実施形態⑤","内容⑥","授業実施形態⑥","内容⑦","授業実施形態⑦","内容⑧","授業実施形態⑧","内容⑨","授業実施形態⑨","内容⑩","授業実施形態⑩","内容⑪","授業実施形態⑪","内容⑫","授業実施形態⑫","内容⑬","授業実施形態⑬","内容⑭","授業実施形態⑭","内容⑮","授業実施形態⑮","内容（試験）","授業実施形態（試験）","程度（対面）","特徴・留意点（対面）","程度（ハイフレックス）","特徴・留意点（ハイフレックス）","程度（オンデマンド）","特徴・留意点（オンデマンド）","程度（その他）","特徴・留意点（その他）","内容②","授業実施形態②"
"91","ishii-daiki","inagaki","2022/01/12 17:07","2021/12/27 10:51","全コース共通","選択必修","2","3Q","選択必修","情報技術者倫理","Computer Ethics for Information Society","稲垣 実","　この科目では、「何故、情報技術者に倫理観が必要なのか」といった問いかけから、情報技術者に関係する各種法令やガイドライン、ルール、マナー、エチケットが構成されてきたことを確認し、その重要性や社会的背景を考慮しながら、自らの業務にどのように適用させるべきかを考え、グループで検討する。また、この科目で検討していく内容は、システム開発者や情報化の推進者として様々なジレンマに直面することがあるが、これらの事象は、情報技術の発展が定着したビジネスルールと相反するものでもあり、どの様に解決すべきか、常に考えていく必要がある。
　講義の進め方は、1週間の中で都合の良い時間にWeb教材による事前学習を行い、大学院での対面講義とグループ討議によって考えを深化させ、その成果を導く「ブランディッド・ラーニング」とする。","　この科目は、まずは情報技術者として遵守すべき法令やガイドラインおよび一般化したマナーに関する基本的な知識を修得し、次に情報技術者が備えるべき倫理観を育み、その知識と倫理観を現実社会の諸問題に応用できるスキルを修得することを主たる目的とする。そのため、対面回のグループ討議においては、積極的に意見を述べるとともに、メンバーの意見を傾聴する姿勢が望まれる。
　あわせて、内部統制、ITガバナンスの意義や目的、法令遵守状況の評価・改善活動などを理解することにより、情報技術者としての倫理観を高めることを目指す。
","特になし（情報システムやインターネットの利活用に関する基本的な知識があることが望ましい）。","情報技術者倫理の高度な知識・スキルを有し、情報技術者のプロフェッショナルとしての業務を遂行でき、経験や実績に基づいて倫理的観点を含めた作業指示ができる。また、情報技術者のプロフェッショナルとして求められる経験を形式知化し、後進育成に応用できる。","情報技術者倫理の基本的知識・スキルを有し、一定程度の難易度又は要求された作業について、倫理的観点を含めながら独力で遂行できる。","　3回目以降の奇数回でのグループ討議にて積極的に意見を述べるために、各回ごとに設定したテーマに関する自らの経験談やメディアなどの情報を整理しておくことが望ましい。","　この科目は、講師独自のオリジナルプリントで行う。偶数回のWeb講義では、受講後のLMSで行われる視聴確認テストを通じて知識の定着を図り、奇数回の対面講義では、グループ討議を通じて応用力を高め、小レポートの作成を通じて自分の業務に適用できる能力を育成する。
　なお、授業内容の詳細は、第1回目の「アンケート」や、直近の「情報技術関連事件」などにより、内容を変更することがある。","","講義中に行う課題と期末テストを合わせて100点満点評価する。
　・課題: 70点（テーマ別となる2-3、4-5、6-7、8-9、10-11、12-13、14-15回の活動を評価する）
　・期末試験: 30点（２つのテーマを出題し、それぞれ800文字程度で論じたものを評価する）","教材はLMS上に「オリジナルプリント」を提供する。","参考図書類はレジュメなどで紹介する。（購入は、受講者各自の判断に委ねる）","【オリエンテーションと基本講義】
当該科目の目的と内容および評価方法、講義を進める上で必要となる「情報技術者倫理」に関する基本用語を解説する。内容を調整するために、前提知識テスト（評価対象外）を実施する。","[対]","【民法改正と知的財産権②】
第2回の講義内容を前提に、民法改正による情報システム開発や情報サービス産業への影響、ファスト動画における著作人格権や著作財産権および著作物の引用などをグループ議論を通じて気付きを獲得する。","[対]","【インターネットの影響①】
インターネットを構築する技術者、およびインターネットの利用者の視点に立って、サイバー犯罪やマルウェア、ネットトラブルなどの事例を踏まえながら、その対策を考える講義を行う。","[録]","【インターネットの影響②】
第4回の講義内容を前提に、ダークウェブで展開されるアンダーグラウンドビジネスの展開、若者たちが夢中になるネットゲームにおけるチート行為などの事例の問題点や具体的な対策などをグループ議論を通じて気付きを獲得する。","[対]","【情報セキュリティ関連法規①】
サイバーセキュリティに関する施策の基本となるサイバーセキュリティ基本法などの考え方を修得し、セキュリティ上の脅威を確認し、その対策を適用するための講義を行う。","[録]","【情報セキュリティ関連法規②】
ネットワークサービスを利用する際のアカウントやクレジット情報などを搾取するフィッシング詐欺が急増している背景、ＳＮＳ利用から派生するフォトハラスメントについて、その問題点や具体的な対策などをグループ議論を通じて気付きを獲得する。","[対]","【情報サービス産業と情報倫理①】
情報化社会をリードする情報サービス産業の視点からＩｏＴやＡＩなどのＩＴトレンドを駆使して実現するSociety5.0について理解し、ＩＴトレンド利活用に関する際の倫理観などの講義を行う。","[録]","【情報サービス産業と情報倫理②】
ソサイエティ5.0実現に向けた共通重要課題と主な論点と検討の方向性に向けた規制・制度、社会受容性、およびマイナンバー制度とマイナンバーカードの利活用における問題点などをグループ議論を通じて気付きを獲得する。","[対]","【個人情報とプライバシー①】
個人情報保護やプライバシー保護の考え方や実際の保護に関する手法や技法、マイナンバー制度などの考え方を修得し、業務へ適用するための講義を行う。","[録]","【個人情報とプライバシー②】
個人情報保護違反やプライバシー保護違反などの事例、街中にある防犯カメラや自動車のドライブレコーダーにおける肖像権やプライバシー権などの問題点などをグループ議論を通じて気付きを獲得する。","[対]","【企業とコンプライアンス①】
法と企業のコンプライアンスの在り方、さらに企業のITガバナンスの仕組みづくりについて考え、業務への適用を目的とした講義を行う。","[録]","【企業とコンプライアンス②】
ＧＡＦＡを取り巻く経営環境と各国においる様々な課題およびＧＡＦＡとどの様に各国は共存すべきか、また、ユニコーン企業の事例を参考にどの様な要素や要因を持つベンチャー企業がユニコーン企業へと成長できるか、などをグループ議論を通じて気付きを獲得する。","[対]","【情報倫理教育①】
従来の倫理教育を踏まえ、情報技術者倫理とは何かを再度確認し、情報技術者としてどの様な情報倫理教育をすべきかをさまざまな視点から考え、業務への適用を目的とした講義を行う。","[録]","【情報倫理教育②】
この科目のまとめとして、小・中学校や高等学校の学校教育における基礎倫理や情報倫理教育はどうあるべきか、また、情報系の大学・大学院や専門学校における情報技術者倫理教育についてどうあるべきか、などをグループ議論を通じて気付きを獲得する。","[対]","これまでに学んだ知識の確認と、それを利用した事例分析ができるかどうかを問う基本的な論述問題に解答する。
パンデミックの状況により、レポートに切り替えることがある。","[対]","○","奇数回は対面講義とグループ討議を品川キャンバスにて行い、グループ討議の結果を踏まえた小レポートの提出によって平常点を加点する。
パンデミックの状況によっては、ハイフレックス型に切り替える。","―","","○","偶数回はWeb講義を自分のペースで受講するオンデマンド型とし、受講後の視聴確認テストの合格点をもって出席とみなし、質問などはLMSにて受け付ける。","―","","【民法改正と知的財産権①】
民法の改正、および知的財産権法、著作権法、産業財産権法の中心となる4法、不正競争防止法などに関わる法律の考え方を修得し、業務へ適用するための講義を行う。","[録]"
"17","manabe-takashi","takahashi-h","2022/03/04 16:31","2020/06/09 15:13","情報アーキテクチャコース","選択","2","4Q","IT","セキュアシステム管理運用特論","Secure System Operation","真鍋 敬士","情報セキュリティ上の脅威に対抗するためには、最新の情報セキュリティに関する情報を収集するとともに、平時におけるシステムの状況を把握できるようにする等、日常的な運用作業での取り組みが有効である。
本講義では、情報システムに対する攻撃を想定したシステム運用や事案発生時の対処方法について事例をあげながら紹介する。また、情報セキュリティに関するテーマでグループワークを行い、調査方法や対策等の提案も含めてプレゼンテーション形式で報告していただく。","システムをセキュアに管理運用していく上で関係する要素技術の整理を行い、それらが情報セキュリティ上の脅威に対してどのように影響を及ぼすのかについて理解することを目的とする。特に、事案発生時の調査や分析においてどのようなデータがどのように活用され得るかについて学習することにより、それらを意識した平時の運用や対応を習慣化することを目指す。
具体的には、学習者はこの講義を通じて以下の知識・能力を習得することができる。
1. 情報システムに対する脅威の変遷と最新の傾向や動向についての知識を習得する。
2. 実際のデータを用いた作業や事例の調査を通して、学習した要素技術の実用方法を理解する。
この科目を通して学習・体験する技術や手法には、専門事業者が持つ高価な設備と経験に基づく高度な知識を背景に実施されるべきものもある。この科目ではそれらを習得することを目指すのではなく、それらに対する認識を深めることにより、専門事業者をより有効に活用する視点を養うことを狙いとしている。

修得できる知識単位: 
・（システム）　　ネットワークの利用技術（レベル4）
・（保守・運用）　システム保守・運用・評価（レベル4）
・（保守・運用）　障害修理技術（レベル4）
・（保守・運用）　施工実務技術（レベル4）
・（非機能要件）　セキュリティの基礎技術（レベル4）
・（非機能要件）　セキュリティの構築技術（レベル4）","コンピュータのアーキテクチャやネットワークに関する知識を前提として講義を行うため、ネットワーク関係の講義を受講しているか、業務等において同等の知識を持っていること。","・最新の情報セキュリティに関する情報を収集することができるようになる。
・発生し得る事案に対して、可能な限り早期に検知するために必要なシステムの構成を検討、提案できるようになる。","・学習時における情報セキュリティ事情を知識として持つことができる。
・発生した事案に対してトリアージを行い、担当者や専門事業者等への依頼を適切に行うことができるようになる。","・授業後に提出する出席票にフィードバックを記入する。
・報道等で取り上げられる情報セキュリティに関する話題に注目し、日常的に情報収集する習慣を身に付ける。
・ハンズオンの内容の再確認を各自で行う。
・グループワーク等に関する調査や取りまとめをグループ内で調整・分担して行う。","授業は、以下の3部構成となっている。
1. イントロダクション: 情報セキュリティの概論や関連する要素技術について、この科目の視点で(再)学習する。
2. 調査・分析: ネットワーク、マルウェア、システムの調査・分析手法について、その意味や手法等を学習する。
3. 事案対応

この科目では、講義の中でも可能な限り実作業を実施できるように、早い回において作業環境の構築を行う。その環境を使うことで、随時ハンズオンを行ったり、グループワークにおいてドリルやCTFのような方式を採用することにより、トレーニング手法を体験していただく。なお、ハンズオンやグループワークのテーマや実施日程は、講義日程等により調整する可能性がある。
なお、新型ウイルス感染症の流行状況によっては、対面授業を減らし、遠隔及び録画授業を多めにする等の工夫を行う。","a0103","次の3つのポイントで評価する(合計100点満点)。
・課題  10点
講義後に課した課題を各個人で1週間内に提出する。適切な質問や意見など講義への積極的な参加実績も加味する。
・プレゼンテーション（発表内容）  40点
グループ単位で発表内容によって評価する。評価は学生による採点を中心に行う。
・最終試験  50点
第15回の講義終了後に試験を行う。試験を同等のレポート提出とする場合もある。","LMSで配布するので、各自授業前にダウンロードすること。","Chris Sanders著『実践 パケット解析 第3版 ―Wiresharkを使ったトラブルシューティング』 （オライリージャパン、2012年）、3,456円、ISBN4873118441
新井 悠, 岩村 誠, 川古谷 裕平, 青木 一史, 星澤 裕二著『アナライジング・マルウェア ―フリーツールを使った感染事案対処』 （オライリージャパン、2010年)、3,240円、ISBN4873114551
鎌田 敬介著『サイバーセキュリティマネジメント入門』（きんざい、2017年）、1,728円、ISBN4322132151
Douglas E. Comer著『Internetworking with TCP/IP Volume One』 （Prentice Hall、2013年）、$157.8、ISBN013608530X
Michael Ligh, Steven Adair, Blake Hartstein, Matthew Richard著『Malware Analyst's Cookbook and DVD: Tools and Techniques for Fighting Malicious Code』（Wiley、2010年）、$59.99、ISBN0470613033
不正アクセス対策法制研究会 編著『逐条 不正アクセス行為の禁止等に関する法律〔第2版〕』 （立花書房、2012年)、3,640円、ISBN480370919X
山本 正行著『クレジットカードの仕組と決済代行業者の位置づけ』、 https://www.cao.go.jp/consumer/doc/100924_shiryou1.pdf","この科目における学習内容と講義の進め方についての概説と情報セキュリティの基礎となる考え方の紹介を行う。","[録]","ネットワーク、オペレーティングシステム、プログラミング、認証等の要素技術を情報セキュリティの視点から再確認する。","[録]","第3回に続いて要素技術の再確認を行い、情報システムの調査を題材としたハンズオンを実施する。","[録]","ネットワーク上のデータを解析する手法について学習する。","[録]","【グループワーク】ネットワーク解析に関する課題に対する調査を実施する。","[ハ]","ネット上の公開情報をもとに調査・収集を行うオープンソースインテリジェンスについて学習する。","[録]","ウィルスや攻撃ツール等の「マルウェア」の解析で使われる技術や求められる環境等について学習する。","[録]","システムの調査・解析の手法や環境について説明することで、デジタルフォレンジックスにおいて使われる技術について学習する。","[録]","第8,9回で学習したシステム解析やマルウェア解析において使われる手法や技術のいくつかを取り上げて、ハンズオンを実施する。","[録]","情報セキュリティに関する実際の事件や事案を取り上げ、報道のされ方や関係する法令、その後の取り組み等の視点から学習する。","[録]","【グループワーク】これまで学習した分析手法を体感することを目的とした演習を実施する。初回は提示された課題を解くことで教材データへの理解を深める。","[ハ]","【グループワーク】第12回で扱った教材データから状況を想定してとるべき対処を検討する。","[ハ]","【グループワーク】第12,13回の分析や検討の結果をもとに、原因や対策、実際の事案等について調査する。","[ハ]","【グループワーク】第12,13,14回の内容についてプレゼンテーションを行う。","[ハ]","第15回の講義終了後に試験を行う。試験を同等のレポート提出とする場合もある。","[ハ]","―","","○","グループワーク（ドリル形式とCTF形式の演習とプレゼンテーション）および試験は対面もしくは遠隔での出席を求める。出席票の提出をもって出席とみなす。
なお、グループワークへの参加実績は講義時間外での作業も含めて判断するものとし、当日欠席の場合でも録画視聴と出席票の提出を期待する。","○","座学講義とハンズオン型の演習は対面、遠隔、録画視聴のいずれでも出席を可とする。録画視聴については、特段の理由がない限り、次回講義前に済ませることを期待する。出席票の出席をもって出席とみなす。","―","","情報システムに対する脅威の変遷と最新の傾向を学習する。","[録]"
