"レコード番号","更新者","作成者","更新日時","作成日時","コース名","必修・選択","単位数","学期","科目群","科目名","（英文表記）","教員名","概要","目的・狙い","履修条件 （履修者数の上限、 要求する前提知識 等）","上位到達目標","下位到達目標","授業外の学習","授業の内容","科目ID","成績評価","教科書・教材","参考図書","内容①","授業実施形態①","内容➂","授業実施形態➂","内容④","授業実施形態④","内容⑤","授業実施形態⑤","内容⑥","授業実施形態⑥","内容⑦","授業実施形態⑦","内容⑧","授業実施形態⑧","内容⑨","授業実施形態⑨","内容⑩","授業実施形態⑩","内容⑪","授業実施形態⑪","内容⑫","授業実施形態⑫","内容⑬","授業実施形態⑬","内容⑭","授業実施形態⑭","内容⑮","授業実施形態⑮","内容（試験）","授業実施形態（試験）","程度（対面）","特徴・留意点（対面）","程度（ハイフレックス）","特徴・留意点（ハイフレックス）","程度（オンデマンド）","特徴・留意点（オンデマンド）","程度（その他）","特徴・留意点（その他）","内容②","授業実施形態②"
"1","ishii-daiki","takahashi-h","2022/01/12 13:50","2020/06/09 15:13","情報アーキテクチャコース","選択","2","3Q","システム開発","セキュアプログラミング特論","Secure Programming","黄 緒平","インターネットが日常生活や企業での業務等に欠かせない社会基盤となり、多数のソフトウェアがネットワーク経由で多くのユーザに利用されるようになった現在では、脆弱性を持つ情報システムに対する攻撃が年々深刻化している。本講義では、脆弱性を含まない安全なソフトウェアを開発するための技術及びノウハウを解説する。具体的には、C言語で開発されたソフトウェアについて、文字列操作、動的メモリ管理、ファイル入出力等にまつわる脆弱性の具体例を示し、静的解析ツール、動的解析ツール、アドレス空間配置のランダム化等を活用した脅威の緩和策を示す。","　当科目では以下の項目を目的とする。
・ バッファオーバーフローのメカニズムを理解し、緩和策を把握する
・ C言語の文字列の取り扱い時の典型的なエラーを理解する
・ 整数型の仕様及び型変換の仕様を理解し、整数演算に関する典型的なエラーを把握する
・ 書式付き入出力の仕様を理解し、書式付き入出力関数の誤用がメモリ内容の漏洩及び改ざんに繋がることを理解する
・ メモリの動的管理のメカニズムを理解し、メモリ管理にまつわるエラーを把握する
・ ファイル入出力に関するTOCTOU競合状態を理解し、対抗策を把握する
・ Common Weakness Enumeration（CWE）データベースを活用して脆弱性の事例を調査する能力を修得する
・ 静的解析ツールを活用して、ソースコード中の欠陥を調査する能力を身につける
・ チームメンバーとの協調作業を通じてセキュア開発についての実践スキルを磨く
修得できる知識単位：
 ・（システム）　ソフトウェアの基礎技術（レベル4）
 ・（システム）　ソフトウェアの構築技術（レベル4）
 ・（システム）　Webシステムの基礎技術（レベル4）
 ・（非機能要件）　セキュリティの構築技術（レベル4）
 ・（非機能要件）　セキュリティの利用技術（レベル4）
 ・（非機能要件）　セーフティ（分析、設計）（レベル4）","以下の科目を修了しているかあるいは修了と同等の技量を持つこと。
・ システムソフトウェア特論
・ 情報セキュリティ特論
C言語によるプログラミング経験があることが望ましいが必須ではない（必要に応じてポインタ等の概念を復習しつつ講義を進める）。","・脆弱性を持つオープンソースソフトウェアの事例を調査し、調査結果を後進の技術者に対して自分自身の言葉で説明できる。
・脆弱性を持つコードが与えられた場合に、コーディング・運用の場面において現実的な脅威の緩和策を複数提案できる。","・バッファオーバーフローとはどのようなものかを理解し、バッファオーバーフローの脆弱性が存在するソースコードが与えられた場合にその原因箇所を独力で調査し、指摘することができる。
・単独で静的解析ツールを活用してソースコードのセキュリティに関する検査が実施できる。","・個人別課題では、静的解析ツールを活用したソースコード検査を実施し、検査結果レポートを提出すること。
・グループ別課題において、チームメンバーとして各自の分担タスクを実施すること。","　本講義では、C言語によるセキュアプログラミングの知識を習得し、チームによる課題解決活動を通じて実践経験を積む。対象環境はLinuxとする。サンプルコードの提示のために主にC言語を利用する。一部アセンブラ言語を使用。グループワークでは、５名程度のチームに分かれて、静的解析ツール又は動的解析ツール等のセキュアプログラミングに関連するツール等の調査を実施する（調査対象のツール等は各チームで決定する）。授業外活動時間及び授業時間中のグループワーク時間を利用してチーム活動を実施する。","a0304","筆記試験40%、課題60%で評価する。課題は個人別課題（静的解析ツールを活用したソースコード検査）及びグループ別課題（チームが選定したツールについての調査及び発表）の2件である。","講義資料はLMSで提供する。","[1] Robert C. Seacord 著、『C/C++セキュアコーディング 第2版』（KADOKAWA/アスキー・メディアワークス、2014 年） 
[2] Robert C. Seacord 著、JPCERT コーディネーションセンター久保正樹、戸田洋三訳『CERT C セキュアコーディングスタンダード』（株式会社アスキー・メディアワークス、2009 年）","この科目における学習内容と講義の進め方についての概説と情報セキュリティの基
礎となる考え方の紹介を⾏う。","[ハ]","ネットワーク、オペレーティングシステム、プログラミング、認証等の要素技術を情報セキュリティの視点から再確認する。","[ハ]","第3回に続いて要素技術の再確認を⾏い、情報システムの調査を題材としたハンズオンを実施する。","[ハ]","ネットワーク上のデータを解析する手法について学習する。","[ハ]","【グループワーク】ネットワーク解析に関する課題に対する調査を実施する。","[ハ]","ネット上の公開情報をもとに調査・収集を⾏うオープンソースインテリジェンスについて学習する。","[ハ]","ウィルスや攻撃ツール等の「マルウェア」の解析で使われる技術や求められる環境等について学習する。","[ハ]","システムの調査・解析の手法や環境について説明することで、デジタルフォレンジックスにおいて使われる技術について学習する。","[ハ]","第8,9回で学習したシステム解析やマルウェア解析において使われる手法や技術のいくつかを取り上げて、ハンズオンを実施する。","[ハ]","情報セキュリティに関する実際の事件や事案を取り上げ、報道のされ方や関係する法令、その後の取り組み等の視点から学習する。","[ハ]","【グループワーク】これまで学習した分析手法を体感することを目的とした演習を実施する。初回は提⽰された課題を解くことで教材データへの理解を深める。","[ハ]","【グループワーク】第12回で扱った教材データから状況を想定してとるべき対処を検討する。","[ハ]","【グループワーク】第12,13回の分析や検討の結果をもとに、原因や対策、実際の事案等について調査する。","[ハ]","【グループワーク】第12,13,14回の内容についてプレゼンテーションを⾏う。","[ハ]","第15回の講義終了後に試験を⾏う。試験を同等のレポート提出とする場合もある。","[対]","―","","○","実習・演習の進捗等により予定を変更する場合がある。
演習のプレゼンテーションや調査結果の説明等を行っていただく。
ハンズオンを中心とした演習を各自で行っていただく。
ハンズオン、ドリル、CTF(Capture The Flag)といった形式を採り入れ、よ
り現実味のあるテーマの課題をグループで協力して解いていただく。","―","","―","","情報システムに対する脅威の変遷と最新の傾向を学習する。","[ハ]"
"18","ishii-daiki","takahashi-h","2022/01/12 17:07","2020/06/09 15:13","創造技術コース","選択","2","3Q","インダストリアル・デザイン","コミュニケーションデザイン特論","Communication Design","高嶋 晋治/河西 大介","「コミュニケーションデザイン」は近年のデジタル技術の発達とともにその概念が大きく変化し、単純なビジュアルデザインから GUI、HMI などからインタラクションデザイン、さらには社会的な共同体との関係性構築まで概念が大きく拡大し、またダイナミックに変化を続けている。 
本講義では、何かを伝えるという「コミュニケーションデザイン」に関わっていく際に必要な基本知識の習得と概念の構築、またコミュニケーションデザインの基本スキルとプロセスを学んでいく。
特にHMI(Human Machine Interface)におけるインタラクションデザインやさらに社会的な関係性の構築を目指す新概念のコミュニケーションデザインまでの事例の紹介と研究、また実践的なスモールプロジェクトを行うことで開発実務に必要な知識やスキルの習得を目指す。 ","本講義は、大きく以下の四つのパートによって構成される。まず「コミュニケーション」や「コミュニケーションデザイン」の基本知識と現在のインタラクションデザインにまで至る概念の変化や推移について学ぶ。次に「コミュニケーションデザイン」プロセスと基本スキルのポイントを学習する。また企業や社会における様々な事例を具体的に紹介・研究を行い、学んだことをスモールプロジェクトによって実際に基本のプロセスを習得するという四 つの構成である。 
具体的に学習者は、この講義を通じて以下の知識や能力を習得することを目的とする。
1.基礎的な知識:コミュニケーションデザインに関する基本的な概念を学修する。 
2.理論と手法:コミュニケーション理論と手法についての様々な基本理論を理解する。 
3.専門的知識:企業における開発事例、HMI、コミュニケーションデザインの事例を学ぶ。 
4.デザインン技術:グループ演習によってコミュニケーションデザインの解決手法を理解体得する。 
以上によって自身のコミュニケーションデザインの考え方と基本スキルの構築を目指す。
","コミュニケーションデザインに関心を持ち、知識を旺盛に吸収する意欲と、社会におけるデザインの関連事項に敏感に反応して知識として身に付けておくこと。","社会や企業において自ら課題に対してコミュニケーションデザインの方向性を意義付けし、企画及び計画ができる専門的知識を習得する。","コミュニケーションデザインの基本的知識を獲得し、簡単な問題に対して解決の方向性を提案できる。","様々なコミュニケーションに関して関心と問題意識を常に持っていること。
グループ演習回を除く各回には、授業に関連した課題レポートが課せられる。グループ演習回では各自の調査や資料まとめなどを行う必要がある。","講義は毎回配布する資料を利用して行う。資料は授業の構成にしたがい第１回から第15回まで連続したものである。2名の教員で講義を行うが、その分担は初回で説明する。
講義内容を基にしたグループワークとプレゼンを行う演習を３回分実施し、各自の実践的な学習と考察を深める。最終回に講義内容に関連した筆記試験が実施される。","b0404","以下の三つのポイントで評価する (合計 100 点)。評価は10回以上の出席が前提となる。
1)課題・各講義の課題レポート(全9回/1,3,4,6,8,9,10,11,15):20点
・3回の演習課題レポート(全3回/2,5,7):15点 
2)チーム単位でのグループ演習発表:15 点(第 14 回の発表:グループ得点+個人の役割貢献等) 
3)最終試験:50点","教員が授業の際に準備、配布する講義資料を使用する。","必要に応じ、授業の際に適宜紹介する。","講義全体概説とコミュニケーションデザイン概要： 
講義の進め方や学習内容の解説。初回として、拡大するコミュニケーションデザイン全体のイメージを把握し、また日本のグラフィックスの特徴について学ぶ。","[対]","認知特性とコミュニケーションデザイン: 
コミュニケーション理論の基本とデザインを深めていく上での必須の知識である人の認知特性と情報認識の中核を占める視覚特性について学ぶ。","[録]","アフォーダンスと行為: 
環境との関係性を考え直すことで、デザイン概念に影響を与えたアフォーダンスの基本概念を解説、人と環境とのインタラクティブな関係から「行為」を考える。","[録]","表現デザイントレーニング:
レイアウトの進め方と様々な原則を知り、実際に情報を整理し配置することによりレイアウトの重要性を学ぶ。演習課題①講評、演習課題②出題","[ハ]","インタラクションデザインプロセス: 
現代の情報デザインの基本となるインタラクションデザインについて、そのデザインシナリオ、概念モデル、UI構造化など特徴的なプロセスについてIDデザインとの違いを認識して学ぶ。","[録]","色彩とコミュニケーションデザイン: 
人の視覚情報において強い要素である色彩について、基本的な構造の学習と様々なコミュニケーションデザインへの展開事例やコミュニケーションデザインにおける基本的なグラフィックスキルなどについて学ぶ。演習課題③出題","[対]","コミュニケーションデザインにおけるユニバーサルデザイン: 
ユニバーサルデザイン概念について詳細に学習し、コミュニケーションデザインにおけるユニバーサルデザイン概念の広がりについて学ぶ。","[録]","レイアウトデザイントレーニング講評:
第５回の演習課題②の全体講評を行い、多くの事例からレイアウトスキルの基本とCIデザインにおけるロゴ等の扱いに関する基本知識を学ぶ。","[ハ]","HMI(Human Machine Interface)デザインの変遷:
HMIデザインの時間軸による典型的な変化を自動車のインテリアデザインを例として学習し、インタラクションのあり方について考察する。","[録]","最新のインタラクションデザイン研究について:
次のUXデザインに結びついていくような近年の身体性を重視したインタラクションデザインなどの最新研究の方向性について学ぶ。","[録]","スモールプロジェクトによる演習1:テーマ設定と問題の定義
グループ演習としてテーマ設定に沿った課題をグループ内で討議し決定し、その問題点の分析を行う。","[対]","スモールプロジェクトによる演習2:解決手法の決定
グループで選択した課題の問題点の解決手法を検討し決定。発表に向けての準備を行う。","[対]","スモールプロジェクトによる演習3:プレゼンテーション
各グループの最終のプレゼンテーション実施と相互講評を行い、課題への理解を深める。","[対]","スモールプロジェクトの各グループの講評/アドバイス: 
相互評価のまとめ、教員から各グループ発表に関する講評とアドバイス、
第7回講義の演習課題③の全体講評を行う。","[対]","試験:
講義内容を踏まえ、コミュニケーションデザインに関する小論文テストを行う。","[対]","○","スライドを中心とした講義。双方向での質疑や議論など。
12、13、14回のグループ演習回を除く各回に個人課題レポートが出題される(計12回)。
スモールプロジェクトでのグループ討議とプレゼンターション及び質 疑応答。また相互の講評によるポイントの整理と把握。","○","対面型（双方向）に準ずる。","○","課題レポートの提出によって出席とみなす。","―","","情報化時代のコミュニケーションデザインと歴史視点： 
情報化時代のコミュニケーションデザイン概念の広がりとコミュニケーションデザインにおける歴史的視点について学ぶ。演習課題①出題","[ハ]"
